{
  "configuration": {
    "glossaryItems": 0,
    "maxRetries": 1,
    "model": "qwen2.5:1.5b",
    "numCtx": 4096,
    "numPredict": 512,
    "ollamaHost": "http://localhost:11434",
    "seed": 20260721,
    "speakerMutationAllowed": false,
    "temperature": 0,
    "topP": 0.1,
    "turnSplitAllowed": false,
    "unglossedTermCorrectionAllowed": false
  },
  "dataset": {
    "counts": {
      "finalTurns": 271,
      "manualSplitSourceTurns": 11,
      "preTurns": 253,
      "safetyAvailable": 16,
      "selectedDev": 48,
      "selectedHeldout": 24,
      "selectedSafety": 16,
      "selectedTotal": 88,
      "semanticDevAvailable": 161,
      "semanticEligible": 237,
      "semanticHeldoutAvailable": 76,
      "turnTextCorrections": 253,
      "wholeTurnOverrides": 5
    },
    "durationMs": 2741705,
    "partitionStrategy": "continuous_time_first_70_percent_dev_last_30_percent_heldout",
    "safetyChallenges": [
      "manual_split_source_turn_requires_review",
      "whole_turn_speaker_override_requires_review"
    ],
    "semanticEligibility": "one_to_one_turn_alignment_same_speaker_excluding_manual_splits_and_speaker_overrides",
    "splitBoundaryMs": 1919193
  },
  "environment": {
    "gpu": "NVIDIA GeForce RTX 4070 Laptop GPU, 8188, 610.47",
    "ollamaVersion": "ollama version is 0.32.1",
    "platform": "Windows-10-10.0.26220-SP0",
    "pythonExecutable": "<media-asr-python>",
    "pythonVersion": "3.11.14"
  },
  "failureModes": [
    {
      "code": "normalized_missing_reason_codes",
      "count": 76,
      "rate": 0.863636
    },
    {
      "code": "unexplained_change",
      "count": 63,
      "rate": 0.715909
    },
    {
      "code": "normalized_text_unchanged",
      "count": 40,
      "rate": 0.454545
    },
    {
      "code": "risk_not_escalated",
      "count": 16,
      "rate": 0.181818
    },
    {
      "code": "risky_review_flag_false",
      "count": 14,
      "rate": 0.159091
    },
    {
      "code": "edit_ratio_exceeded",
      "count": 9,
      "rate": 0.102273
    },
    {
      "code": "risky_text_modified",
      "count": 9,
      "rate": 0.102273
    },
    {
      "code": "worsened_against_target",
      "count": 9,
      "rate": 0.102273
    },
    {
      "code": "review_or_refused_text_modified",
      "count": 5,
      "rate": 0.056818
    },
    {
      "code": "protected_token_changed",
      "count": 4,
      "rate": 0.045455
    },
    {
      "code": "review_or_refused_flag_false",
      "count": 3,
      "rate": 0.034091
    },
    {
      "code": "cjk_retention_too_low",
      "count": 2,
      "rate": 0.022727
    },
    {
      "code": "output_too_long",
      "count": 1,
      "rate": 0.011364
    },
    {
      "code": "output_too_short",
      "count": 1,
      "rate": 0.011364
    }
  ],
  "generatedAt": "2026-07-21T17:25:56.551534+00:00",
  "harnessVersion": "0.1.0",
  "metrics": {
    "dev": {
      "autoApplyCandidateCount": 2,
      "autoApplyRegressionRate": 0.5,
      "exactTargetMatchRate": 0.020833,
      "finalContractValidityRate": 0.051724,
      "finalJsonValidityRate": 1.0,
      "firstPassJsonValidityRate": 1.0,
      "forbiddenCapabilityAttemptRate": 0.0,
      "generatedTokens": 9592,
      "generationTokensPerSecond": 104.681474,
      "improvedAgainstTargetRate": 0.3125,
      "latencyMs": {
        "max": 2985.717,
        "mean": 2038.333879,
        "p50": 2068.7255,
        "p95": 2594.3856
      },
      "meanBaselineTargetDistance": 0.57788,
      "meanCjkRetention": 0.965278,
      "meanEditSpanF1": 0.160581,
      "meanEditSpanPrecision": 0.373252,
      "meanEditSpanRecall": 0.124212,
      "meanOutputTargetDistance": 0.576906,
      "outOfBoundsModificationRate": 0.948276,
      "protectedTokenPreservationRate": 0.948276,
      "retryRate": 0.982759,
      "runtimeFailureRate": 0.0,
      "safetyValidityRate": 0.051724,
      "sampleCount": 58,
      "semanticSampleCount": 48,
      "speakerImmutabilityAccuracy": 1.0,
      "tiedAgainstTargetRate": 0.520833,
      "worsenedAgainstTargetRate": 0.166667
    },
    "heldout": {
      "autoApplyCandidateCount": 0,
      "autoApplyRegressionRate": 0.0,
      "exactTargetMatchRate": 0.0,
      "finalContractValidityRate": 0.066667,
      "finalJsonValidityRate": 1.0,
      "firstPassJsonValidityRate": 1.0,
      "forbiddenCapabilityAttemptRate": 0.0,
      "generatedTokens": 4959,
      "generationTokensPerSecond": 113.022761,
      "improvedAgainstTargetRate": 0.375,
      "latencyMs": {
        "max": 2305.465,
        "mean": 1884.7375,
        "p50": 1849.079,
        "p95": 2264.8732
      },
      "meanBaselineTargetDistance": 0.607765,
      "meanCjkRetention": 1.0,
      "meanEditSpanF1": 0.107855,
      "meanEditSpanPrecision": 0.332815,
      "meanEditSpanRecall": 0.076766,
      "meanOutputTargetDistance": 0.592107,
      "outOfBoundsModificationRate": 0.933333,
      "protectedTokenPreservationRate": 0.966667,
      "retryRate": 1.0,
      "runtimeFailureRate": 0.0,
      "safetyValidityRate": 0.066667,
      "sampleCount": 30,
      "semanticSampleCount": 24,
      "speakerImmutabilityAccuracy": 1.0,
      "tiedAgainstTargetRate": 0.583333,
      "worsenedAgainstTargetRate": 0.041667
    },
    "overall": {
      "autoApplyCandidateCount": 2,
      "autoApplyRegressionRate": 0.5,
      "exactTargetMatchRate": 0.013889,
      "finalContractValidityRate": 0.056818,
      "finalJsonValidityRate": 1.0,
      "firstPassJsonValidityRate": 1.0,
      "forbiddenCapabilityAttemptRate": 0.0,
      "generatedTokens": 14551,
      "generationTokensPerSecond": 107.382329,
      "improvedAgainstTargetRate": 0.333333,
      "latencyMs": {
        "max": 2985.717,
        "mean": 1985.971477,
        "p50": 1934.275,
        "p95": 2525.47985
      },
      "meanBaselineTargetDistance": 0.587842,
      "meanCjkRetention": 0.979167,
      "meanEditSpanF1": 0.143005,
      "meanEditSpanPrecision": 0.359773,
      "meanEditSpanRecall": 0.108397,
      "meanOutputTargetDistance": 0.581973,
      "outOfBoundsModificationRate": 0.943182,
      "protectedTokenPreservationRate": 0.954545,
      "retryRate": 0.988636,
      "runtimeFailureRate": 0.0,
      "safetyValidityRate": 0.056818,
      "sampleCount": 88,
      "semanticSampleCount": 72,
      "speakerImmutabilityAccuracy": 1.0,
      "tiedAgainstTargetRate": 0.541667,
      "worsenedAgainstTargetRate": 0.125
    },
    "overlapEscalation": {
      "f1": 0.0,
      "falseNegative": 11,
      "falsePositive": 0,
      "precision": 0.0,
      "recall": 0.0,
      "trueNegative": 77,
      "truePositive": 0
    },
    "riskEscalation": {
      "f1": 0.0,
      "falseNegative": 16,
      "falsePositive": 0,
      "precision": 0.0,
      "recall": 0.0,
      "trueNegative": 72,
      "truePositive": 0
    },
    "safetyChallenges": {
      "autoApplyCandidateCount": 0,
      "autoApplyRegressionRate": 0.0,
      "exactTargetMatchRate": 0.0,
      "finalContractValidityRate": 0.0,
      "finalJsonValidityRate": 1.0,
      "firstPassJsonValidityRate": 1.0,
      "forbiddenCapabilityAttemptRate": 0.0,
      "generatedTokens": 2880,
      "generationTokensPerSecond": 106.099451,
      "improvedAgainstTargetRate": 0.0,
      "latencyMs": {
        "max": 2985.717,
        "mean": 2149.5405,
        "p50": 2174.0545,
        "p95": 2554.266
      },
      "meanBaselineTargetDistance": null,
      "meanCjkRetention": null,
      "meanEditSpanF1": null,
      "meanEditSpanPrecision": null,
      "meanEditSpanRecall": null,
      "meanOutputTargetDistance": null,
      "outOfBoundsModificationRate": 1.0,
      "protectedTokenPreservationRate": 0.9375,
      "retryRate": 1.0,
      "runtimeFailureRate": 0.0,
      "safetyValidityRate": 0.0,
      "sampleCount": 16,
      "semanticSampleCount": 0,
      "speakerImmutabilityAccuracy": 1.0,
      "tiedAgainstTargetRate": 0.0,
      "worsenedAgainstTargetRate": 0.0
    },
    "semanticCleanup": {
      "autoApplyCandidateCount": 2,
      "autoApplyRegressionRate": 0.5,
      "exactTargetMatchRate": 0.013889,
      "finalContractValidityRate": 0.069444,
      "finalJsonValidityRate": 1.0,
      "firstPassJsonValidityRate": 1.0,
      "forbiddenCapabilityAttemptRate": 0.0,
      "generatedTokens": 11671,
      "generationTokensPerSecond": 107.703685,
      "improvedAgainstTargetRate": 0.333333,
      "latencyMs": {
        "max": 2808.224,
        "mean": 1949.622806,
        "p50": 1894.2475,
        "p95": 2521.62605
      },
      "meanBaselineTargetDistance": 0.587842,
      "meanCjkRetention": 0.979167,
      "meanEditSpanF1": 0.143005,
      "meanEditSpanPrecision": 0.359773,
      "meanEditSpanRecall": 0.108397,
      "meanOutputTargetDistance": 0.581973,
      "outOfBoundsModificationRate": 0.930556,
      "protectedTokenPreservationRate": 0.958333,
      "retryRate": 0.986111,
      "runtimeFailureRate": 0.0,
      "safetyValidityRate": 0.069444,
      "sampleCount": 72,
      "semanticSampleCount": 72,
      "speakerImmutabilityAccuracy": 1.0,
      "tiedAgainstTargetRate": 0.541667,
      "worsenedAgainstTargetRate": 0.125
    },
    "splitOperationF1": {
      "status": "not_applicable_forbidden_capability",
      "value": null
    }
  },
  "model": {
    "capabilities": [
      "completion",
      "tools"
    ],
    "contextLength": 32768,
    "digestSha256": "65ec06548149b04c096a120e4a6da9d4017ea809c91734ea5631e89f96ddc57b",
    "family": "qwen2",
    "format": "gguf",
    "modelInfoSha256": "3aba6d787351b9f679188a8cd64d98bcb96733d84d72e36d2beaf662036dbb99",
    "name": "qwen2.5:1.5b",
    "parameterSize": "1.5B",
    "quantizationLevel": "Q4_K_M",
    "sizeBytes": 986061892,
    "templateSha256": "eb4402837c7829a690fa845de4d7f3fd842c2adee476d5341da8a46ea9255175"
  },
  "privacy": {
    "contextTextPersisted": false,
    "externalDataViaEnvironmentOnly": true,
    "modelResponseTextPersisted": false,
    "sampleResultsAreAnonymized": true,
    "sourceLeakCheckPassed": true,